{"schema_version":1,"contains_flags":[{"id":"pork","label":{"en":"Pork","de":"Schweinefleisch"},"category":"meat","eu_allergen":false},{"id":"beef","label":{"en":"Beef","de":"Rindfleisch"},"category":"meat","eu_allergen":false},{"id":"lamb","label":{"en":"Lamb","de":"Lammfleisch"},"category":"meat","eu_allergen":false},{"id":"poultry","label":{"en":"Poultry","de":"Geflügel"},"category":"meat","eu_allergen":false},{"id":"fish","label":{"en":"Fish","de":"Fisch"},"category":"seafood","eu_allergen":true},{"id":"shellfish","label":{"en":"Crustaceans","de":"Krebstiere"},"category":"seafood","eu_allergen":true},{"id":"molluscs","label":{"en":"Molluscs","de":"Weichtiere"},"category":"seafood","eu_allergen":true},{"id":"egg","label":{"en":"Egg","de":"Ei"},"category":"animal","eu_allergen":true},{"id":"dairy","label":{"en":"Dairy","de":"Milchprodukte"},"category":"animal","eu_allergen":true},{"id":"lactose","label":{"en":"Lactose","de":"Laktose"},"category":"animal","eu_allergen":false},{"id":"honey","label":{"en":"Honey","de":"Honig"},"category":"animal","eu_allergen":false},{"id":"gelatin-non-halal","label":{"en":"Non-halal gelatin","de":"Nicht-halal-Gelatine"},"category":"animal","eu_allergen":false},{"id":"gelatin-non-kosher","label":{"en":"Non-kosher gelatin","de":"Nicht-koschere Gelatine"},"category":"animal","eu_allergen":false},{"id":"meat-dairy-combo","label":{"en":"Meat & dairy together","de":"Fleisch & Milch zusammen"},"category":"animal","eu_allergen":false},{"id":"gluten","label":{"en":"Gluten","de":"Gluten"},"category":"grain","eu_allergen":true},{"id":"soy","label":{"en":"Soy","de":"Soja"},"category":"legume","eu_allergen":true},{"id":"peanuts","label":{"en":"Peanuts","de":"Erdnüsse"},"category":"legume","eu_allergen":true},{"id":"lupin","label":{"en":"Lupin","de":"Lupine"},"category":"legume","eu_allergen":true},{"id":"tree-nuts","label":{"en":"Tree nuts","de":"Schalenfrüchte"},"category":"nut","eu_allergen":true},{"id":"almonds","label":{"en":"Almonds","de":"Mandeln"},"category":"nut","eu_allergen":true},{"id":"walnuts","label":{"en":"Walnuts","de":"Walnüsse"},"category":"nut","eu_allergen":true},{"id":"pistachios","label":{"en":"Pistachios","de":"Pistazien"},"category":"nut","eu_allergen":true},{"id":"cashews","label":{"en":"Cashews","de":"Cashewkerne"},"category":"nut","eu_allergen":true},{"id":"hazelnuts","label":{"en":"Hazelnuts","de":"Haselnüsse"},"category":"nut","eu_allergen":true},{"id":"coconut","label":{"en":"Coconut","de":"Kokosnuss"},"category":"nut","eu_allergen":false},{"id":"sesame","label":{"en":"Sesame","de":"Sesam"},"category":"seed","eu_allergen":true},{"id":"mustard","label":{"en":"Mustard","de":"Senf"},"category":"seed","eu_allergen":true},{"id":"celery","label":{"en":"Celery","de":"Sellerie"},"category":"vegetable","eu_allergen":true},{"id":"nightshades","label":{"en":"Nightshades","de":"Nachtschattengewächse"},"category":"vegetable","eu_allergen":false},{"id":"corn","label":{"en":"Corn","de":"Mais"},"category":"grain","eu_allergen":false},{"id":"yeast","label":{"en":"Yeast","de":"Hefe"},"category":"other","eu_allergen":false},{"id":"sulphites","label":{"en":"Sulphites","de":"Sulfite"},"category":"other","eu_allergen":true},{"id":"alcohol","label":{"en":"Alcohol","de":"Alkohol"},"category":"other","eu_allergen":false},{"id":"caffeine","label":{"en":"Caffeine","de":"Koffein"},"category":"other","eu_allergen":false},{"id":"added-sugar","label":{"en":"Added sugar","de":"Zugesetzter Zucker"},"category":"other","eu_allergen":false},{"id":"high-fodmap","label":{"en":"High FODMAP","de":"Hoch-FODMAP"},"category":"other","eu_allergen":false}],"compound_flags":[{"id":"vegan","label":{"en":"Vegan","de":"Vegan"},"expands_to":["pork","beef","lamb","poultry","fish","shellfish","molluscs","egg","dairy","lactose","honey","gelatin-non-halal","gelatin-non-kosher"],"note":{"en":"Nothing that came from an animal.","de":"Nichts, was von einem Tier stammt."}},{"id":"vegetarian","label":{"en":"Vegetarian","de":"Vegetarisch"},"expands_to":["pork","beef","lamb","poultry","fish","shellfish","molluscs","gelatin-non-halal","gelatin-non-kosher"],"note":{"en":"No meat, no fish, no animal gelatin. Eggs and dairy stay.","de":"Kein Fleisch, kein Fisch, keine Gelatine. Eier und Milch bleiben."}},{"id":"pescatarian","label":{"en":"Pescatarian","de":"Pescetarisch"},"expands_to":["pork","beef","lamb","poultry","gelatin-non-halal","gelatin-non-kosher"],"note":{"en":"Fish and seafood stay on the table.","de":"Fisch und Meeresfrüchte bleiben auf dem Tisch."}},{"id":"halal","label":{"en":"Halal-compatible ingredients","de":"Halal-kompatible Zutaten"},"expands_to":["pork","alcohol","gelatin-non-halal"],"note":{"en":"Ingredient-level only. We never claim certification — that is a property of sourcing and supervision, not of a recipe text.","de":"Nur auf Zutatenebene. Wir behaupten nie eine Zertifizierung — die hängt an Herkunft und Aufsicht, nicht am Rezepttext."}},{"id":"kosher","label":{"en":"Kosher-compatible ingredients","de":"Koscher-kompatible Zutaten"},"expands_to":["pork","shellfish","molluscs","meat-dairy-combo","gelatin-non-kosher"],"note":{"en":"Ingredient-level only. We never claim certification — that is a property of sourcing and supervision, not of a recipe text.","de":"Nur auf Zutatenebene. Wir behaupten nie eine Zertifizierung — die hängt an Herkunft und Aufsicht, nicht am Rezepttext."}},{"id":"gluten-free","label":{"en":"Gluten-free","de":"Glutenfrei"},"expands_to":["gluten"],"note":{"en":"No wheat, rye, barley or spelt.","de":"Kein Weizen, Roggen, Gerste oder Dinkel."}},{"id":"lactose-free","label":{"en":"Lactose-free","de":"Laktosefrei"},"expands_to":["lactose"],"note":{"en":"Aged cheese, butter and ghee are usually fine — only the lactose-carrying dairy is excluded.","de":"Gereifter Käse, Butter und Ghee sind meist in Ordnung — ausgeschlossen wird nur laktosehaltige Milch."}},{"id":"dairy-free","label":{"en":"Dairy-free","de":"Milchfrei"},"expands_to":["dairy","lactose"],"note":{"en":"Nothing from milk at all.","de":"Gar nichts aus Milch."}},{"id":"nut-free","label":{"en":"Nut-free","de":"Nussfrei"},"expands_to":["tree-nuts","almonds","walnuts","pistachios","cashews","hazelnuts","peanuts"],"note":{"en":"Tree nuts and peanuts both excluded.","de":"Schalenfrüchte und Erdnüsse ausgeschlossen."}},{"id":"low-fodmap","label":{"en":"Low FODMAP","de":"Low FODMAP"},"expands_to":["high-fodmap"],"note":{"en":"Gentle on a sensitive gut.","de":"Schonend für einen empfindlichen Darm."}},{"id":"sugar-free","label":{"en":"No added sugar","de":"Ohne Zuckerzusatz"},"expands_to":["added-sugar"],"note":{"en":"Natural sugars in fruit and vegetables stay.","de":"Natürlicher Zucker aus Obst und Gemüse bleibt."}},{"id":"alcohol-free","label":{"en":"Alcohol-free","de":"Alkoholfrei"},"expands_to":["alcohol"],"note":{"en":"Including alcohol that would cook off.","de":"Auch Alkohol, der beim Kochen verdampfen würde."}},{"id":"caffeine-free","label":{"en":"Caffeine-free","de":"Koffeinfrei"},"expands_to":["caffeine"],"note":{"en":"No coffee, no black tea, no cacao nibs.","de":"Kein Kaffee, kein Schwarztee, keine Kakaonibs."}},{"id":"shellfish-free","label":{"en":"Shellfish-free","de":"Ohne Krebs- & Weichtiere"},"expands_to":["shellfish","molluscs"],"note":{"en":"Crustaceans and molluscs both excluded.","de":"Krebstiere und Weichtiere ausgeschlossen."}},{"id":"egg-free","label":{"en":"Egg-free","de":"Ohne Ei"},"expands_to":["egg"],"note":{"en":"No eggs, not even as a binder.","de":"Keine Eier, auch nicht als Bindemittel."}},{"id":"soy-free","label":{"en":"Soy-free","de":"Ohne Soja"},"expands_to":["soy"],"note":{"en":"No tofu, tempeh, edamame or soy sauce.","de":"Kein Tofu, Tempeh, Edamame oder Sojasauce."}}],"attributes":{"effort":[{"id":"easy","label":{"en":"easy","de":"einfach"},"note":{"en":"Hands-on, barely.","de":"Kaum Aufwand."}},{"id":"medium","label":{"en":"medium","de":"mittel"},"note":{"en":"A real cook, still a weeknight.","de":"Richtig kochen, trotzdem werktags machbar."}},{"id":"hard","label":{"en":"involved","de":"aufwendig"},"note":{"en":"You chose this on purpose.","de":"Das hast du dir bewusst ausgesucht."}}],"time_bucket":[{"id":"t15","max_minutes":15,"label":{"en":"≤ 15 min","de":"≤ 15 Min."}},{"id":"t30","max_minutes":30,"label":{"en":"≤ 30 min","de":"≤ 30 Min."}},{"id":"t60","max_minutes":60,"label":{"en":"≤ 60 min","de":"≤ 60 Min."}},{"id":"t60plus","max_minutes":10000,"label":{"en":"over an hour","de":"über eine Stunde"}}],"calorie_bucket":[{"id":"light","max_kcal":400,"label":{"en":"light","de":"leicht"},"range":"≤ 400 kcal"},{"id":"balanced","max_kcal":600,"label":{"en":"balanced","de":"ausgewogen"},"range":"≤ 600 kcal"},{"id":"hearty","max_kcal":800,"label":{"en":"hearty","de":"herzhaft"},"range":"≤ 800 kcal"},{"id":"feast","max_kcal":100000,"label":{"en":"feast","de":"Festmahl"},"range":"over 800 kcal"}],"technique":[{"id":"bake","label":{"en":"bake","de":"backen"}},{"id":"sauté","label":{"en":"sauté","de":"anbraten"}},{"id":"simmer","label":{"en":"simmer","de":"köcheln"}},{"id":"raw","label":{"en":"raw","de":"roh"}},{"id":"grill","label":{"en":"grill","de":"grillen"}},{"id":"fry","label":{"en":"fry","de":"braten"}},{"id":"steam","label":{"en":"steam","de":"dämpfen"}},{"id":"roast","label":{"en":"roast","de":"rösten"}},{"id":"broil","label":{"en":"broil","de":"überbacken"}},{"id":"pan-fry","label":{"en":"pan-fry","de":"in der Pfanne braten"}},{"id":"deep-fry","label":{"en":"deep-fry","de":"frittieren"}},{"id":"stir-fry","label":{"en":"stir-fry","de":"pfannenrühren"}},{"id":"poach","label":{"en":"poach","de":"pochieren"}},{"id":"blanch","label":{"en":"blanch","de":"blanchieren"}}],"descriptor":[{"id":"high-protein","label":{"en":"high protein","de":"proteinreich"}},{"id":"one-pot","label":{"en":"one pot","de":"ein Topf"}},{"id":"meal-prep","label":{"en":"meal prep friendly","de":"meal-prep-tauglich"}},{"id":"kid-friendly","label":{"en":"kid friendly","de":"kinderfreundlich"}},{"id":"budget","label":{"en":"b